id_num,winery,designation,points,price,country,province,variety,description
126817,Nittnaus Anita und Hans,Sauvignon Blanc,87,16,Austria,Burgenland,Sauvignon Blanc,"The warm Burgenland climate has produced a Sauvignon Blanc that goes for the yellow fruits and richness. But there is also a good, crisp lemon streak that brightens the whole wine. For drinking this summer. Screwcap."
129563,Simonnet-Febvre,Fourchaume Premier Cru,91,35,France,Burgundy,Chardonnay,"Concentrated, dense, powerful and full of glistening green fruits, this wine is lightly touched with caramel, but more dominated by ripe acidity. The aftertaste is tight, suggesting good aging potential."
130348,J. Lohr,Late Harvest,90,25,US,California,White Riesling,"Sweet enough to be served as a dessert or with cheeses but not with dessert, this is a luscious, fruity wine that simply delicious. A hint of aprict adds dimension to the superripe apple and pineapple flavors."
131313,Trapiche,Broquel,88,15,Argentina,Mendoza Province,Cabernet Sauvignon,"This '05 Cab, shows berry aromas and some herbal essence, followed by flavors of boysenberry, blackberry, plum and coffee. It's well-oaked and solid, with tannic bite and good texture. A serious and real wine for a good price."
132728,Valley of the Moon,NA,88,16,US,California,Chardonnay,"Rich and full bodied, this is a tremendously ripe Chardonnay that explodes with peach custard, orange popsicle, pineapple, crème brûlée and cinnamon spice flavors, leading to a long, fruity finish."
137088,Wine Guerrilla,NA,82,30,US,California,Zinfandel,"Super-ripe and dry, with raisin and Port flavors wrapped into 16.5% alcohol. It's a good example of what it is, but certainly exceeds balance."
144117,Trapiche,Vina Jose Blanco,91,34,Argentina,Mendoza Province,Malbec,"Very big and brawny is this single-vineyard, new-to-the-market Malbec from grower Jose Blanco. Expect lots of fresh-cut cinnamon on the nose along with leather, earth and gum. Heavy but balanced, with big tannins wrapped in plenty of coconut and mint. Takes a while to grasp; it's a giant with huge fruit and some clumsiness. Better from 2007–2009. Imported by Frederick Wildman & Sons, Ltd."
145455,Von Strasser,Post Vineyard,91,60,US,California,Cabernet Sauvignon,"Fairly tannic now, with a tart, dusty bite of grape skin, and also hefty in acidity. Underneath all that are ripe currant and cassis flavors. This is an age worthy wine that should develop great complexity after 2010."
149050,Wolf Blass,Barrel Fermented,86,12,Australia,South Australia,Chardonnay,"A bright pear and cinnamon nose opens this attractive, medium-weight wine. The palate shows peach and pear flavors, supported by brisk—some might say sharp—acidity, but flabby it isn't. Shows good balance and a nice long spicy finish, where the oak comes on strong."
149659,Chehalem,INOX,90,17,US,Oregon,Chardonnay,"Stainless steel fermented and aged, to bring bright, acid-driven fruit to the forefront. Full-bodied and flavorful, with nicely mixed stone fruits, pineapple, green berries and lemony citrus. It sets up sharply on the palate and holds true, just waiting for some fresh shellfish."
150046,Woodbridge,NA,82,8,US,California,Cabernet Sauvignon,"Inexpensive Cabernet can often be slightly weedy, even rubbery, with a hot feeling to it. So it is with this wine. The Mondavi folks managed to pack in as much blackberry and cassis fruit as they could, but there's really just a hint of it. The tannins are light, the acidity soft, and that's about it."